### ISSUE TITLE
Safari seems to stall websockets 

### ISSUE THREAD

**Issue by scuzzycheese** [snapview/tokio-tungstenite#214]
Behaviour:
Once Safari has connected to a websocket, no processing of the messages seem to happen after that. I feel like this might be more related to async/await than the actual tungstenite framework but I'm not sure. 

Wireshark Capture of the Upgrade request packet that seems to cause the problem:
(I'm aware my code might be the problem but it seems to work fine with Chrome and Firefox)

```
Frame 13: 447 bytes on wire (3576 bits), 447 bytes captured (3576 bits) on interface lo0, id 0
    Interface id: 0 (lo0)
        Interface name: lo0
    Encapsulation type: NULL/Loopback (15)
    Arrival Time: Feb 28, 2022 11:20:38.380195000 SAST
    [Time shift for this packet: 0.000000000 seconds]
    Epoch Time: 1646040038.380195000 seconds
    [Time delta from previous captured frame: 0.003367000 seconds]
    [Time delta from previous displayed frame: 0.003367000 seconds]
    [Time since reference or first frame: 78.893894000 seconds]
    Frame Number: 13
    Frame Length: 447 bytes (3576 bits)
    Capture Length: 447 bytes (3576 bits)
    [Frame is marked: False]
    [Frame is ignored: False]
    [Protocols in frame: null:ip:tcp:http]
    [Coloring Rule Name: HTTP]
    [Coloring Rule String: http || tcp.port == 80 || http2]
Null/Loopback
    Family: IP (2)
Internet Protocol Version 4, Src: 127.0.0.1, Dst: 127.0.0.1
    0100 .... = Version: 4
    .... 0101 = Header Length: 20 bytes (5)
    Differentiated Services Field: 0x00 (DSCP: CS0, ECN: Not-ECT)
        0000 00.. = Differentiated Services Codepoint: Default (0)
        .... ..00 = Explicit Congestion Notification: Not ECN-Capable Transport (0)
    Total Length: 443
    Identification: 0x0000 (0)
    Flags: 0x40, Don't fragment
        0... .... = Reserved bit: Not set
        .1.. .... = Don't fragment: Set
        ..0. .... = More fragments: Not set
    ...0 0000 0000 0000 = Fragment Offset: 0
    Time to Live: 128
    Protocol: TCP (6)
    Header Checksum: 0x0000 [validation disabled]
    [Header checksum status: Unverified]
    Source Address: 127.0.0.1
    Destination Address: 127.0.0.1
Transmission Control Protocol, Src Port: 63597, Dst Port: 8080, Seq: 1, Ack: 1, Len: 391
    Source Port: 63597
    Destination Port: 8080
    [Stream index: 1]
    [Conversation completeness: Incomplete, DATA (15)]
    [TCP Segment Len: 391]
    Sequence Number: 1    (relative sequence number)
    Sequence Number (raw): 4031988806
    [Next Sequence Number: 392    (relative sequence number)]
    Acknowledgment Number: 1    (relative ack number)
    Acknowledgment number (raw): 3213053136
    1000 .... = Header Length: 32 bytes (8)
    Flags: 0x018 (PSH, ACK)
        000. .... .... = Reserved: Not set
        ...0 .... .... = Nonce: Not set
        .... 0... .... = Congestion Window Reduced (CWR): Not set
        .... .0.. .... = ECN-Echo: Not set
        .... ..0. .... = Urgent: Not set
        .... ...1 .... = Acknowledgment: Set
        .... .... 1... = Push: Set
        .... .... .0.. = Reset: Not set
        .... .... ..0. = Syn: Not set
        .... .... ...0 = Fin: Not set
        [TCP Flags: ·······AP···]
    Window: 6379
    [Calculated window size: 408256]
    [Window size scaling factor: 64]
    Checksum: 0xffaf [unverified]
    [Checksum Status: Unverified]
    Urgent Pointer: 0
    Options: (12 bytes), No-Operation (NOP), No-Operation (NOP), Timestamps
        TCP Option - No-Operation (NOP)
            Kind: No-Operation (1)
        TCP Option - No-Operation (NOP)
            Kind: No-Operation (1)
        TCP Option - Timestamps: TSval 436037624, TSecr 436037621
            Kind: Time Stamp Option (8)
            Length: 10
            Timestamp value: 436037624
            Timestamp echo reply: 436037621
    [Timestamps]
        [Time since first frame in this TCP stream: 0.003514000 seconds]
        [Time since previous frame in this TCP stream: 0.003367000 seconds]
    [SEQ/ACK analysis]
        [iRTT: 0.000135000 seconds]
        [Bytes in flight: 391]
        [Bytes sent since last PSH flag: 391]
    TCP payload (391 bytes)
Hypertext Transfer Protocol
    GET / HTTP/1.1\r\n
        [Expert Info (Chat/Sequence): GET / HTTP/1.1\r\n]
            [GET / HTTP/1.1\r\n]
            [Severity level: Chat]
            [Group: Sequence]
        Request Method: GET
        Request URI: /
        Request Version: HTTP/1.1
    Upgrade: websocket\r\n
    Connection: Upgrade\r\n
    Host: localhost:8080\r\n
    Origin: null\r\n
    Pragma: no-cache\r\n
    Cache-Control: no-cache\r\n
    Sec-WebSocket-Key: E/Ia26NWvN6AGn3yO6JFjw==\r\n
    Sec-WebSocket-Version: 13\r\n
    Sec-WebSocket-Extensions: x-webkit-deflate-frame\r\n
    User-Agent: Mozilla/5.0 (Macintosh; Intel Mac OS X 10_15_7) AppleWebKit/605.1.15 (KHTML, like Gecko) Version/15.3 Safari/605.1.15\r\n
    \r\n
    [Full request URI: http://localhost:8080/]
    [HTTP request 1/1]
    [Response in frame: 15]
```

this is how I use the code:
```
async fn accept_connection(stream: TcpStream) {
    let addr = stream.peer_addr().expect("connected streams should have a peer address");
    info!("Peer address: {}", addr);

    let ws_stream = match tokio_tungstenite::accept_async(stream).await {
        Ok(stream) => stream,
        Err(e) => {
            error!("Unable to accept WebSocket connection: {}", e);
            return;
        }
    };

    info!("New WebSocket connection: {}", addr);

    let (mut ws_stream_tx, ws_stream_rx) = ws_stream.split();
    let mut ws_stream_rx = ws_stream_rx.fuse();

    let mut sender: Option<Sender<Message>> = None;
    let mut receiver: Option<Receiver<Message>> = None;

    loop {
        select! {
            () = async {
//This is a tokio broadcast channel
                if let Some(rx) = &mut receiver {
                    match rx.recv().await {
                        Ok(message) => {
//Do Stuff with the message
                        },
                        Err(_e) => {
                            //TODO: deal with the errors
                        }
                    }
                }
            }.fuse() => {},

            msg_res = ws_stream_rx.next() => {
//This is a tokio-tungstenite stream
                match msg_res {
                    Some(Ok(msg)) => {
                        match &msg {
//Do stuff with the message
                        }
                    }
                    Some(Err(e)) => {
                        error!("Error fetching messages from websocket: {}", e);
                        break;
                    }
                    None => {
                        error!("Error fetching messages from websocket");
                        break;
                    }
                }
            }
        }
    }
    info!("Dropping Websocket.");
}

```

**Comment by application-developer-DA** [comment]
We can't confirm this is happening. Please provide the SSCCE if you can reliably reproduce this issue. We use the `tokio-tungstenite` with all browsers and it works as expected.

**Comment by scuzzycheese** [comment]
I have tried reproducing it, and it seems I can't. Apologies. I must have been doing something wrong at the time.
